State,Participant Name,Institution,Collection,Project Title,Link,Years Covered,Year of Interview,Project Overview
Indiana ,Hana Stith,The History Makers,Education Matters,"The HistoryMakers® Video Oral History Interview with Hana Stith,",https://www.thehistorymakers.org/sites/default/files/A2002_136_EAD.pdf,1960-200s,2002,"Hana Stith was born on August 25, 1928 in Fort Wayne, Indiana. She spent 36 years teaching there, mostly in inner city schools where she felt her skills were most needed. She earned respect for her teaching skills and her compassion for children.
Stith joined the junior branch of the NAACP before graduating from Central High School in 1946. She received a scholarship from the Fourth District Lay Organization of the African Methodist Episcopal Church and used it to attend religiously affiliated Wilberforce College in Wilberforce, Ohio, the first institution of higher education owned and operated by African Americans. A dispute between church and state caused Wilberforce to temporarily lose its accreditation and Stith finished her education at St. Francis College. She earned both her bachelor's and master's degrees there and was certified by Purdue University in guidance and counseling.
When Stith became a teacher in 1960, she was one of the first African Americans hired in the Fort Wayne Community Schools. She spent 22 years as a classroom teacher and then became a Title I teacher, instructing students who needed individual attention in reading and math. She retired from teaching in 1996 and became a docent for the Lincoln Museum as well as a board member of the local NAACP chapter. She co-founded the African/African American Historical Society in 1998. In 1999, she found a home for the African/African American Historical Museum in Fort Wayne, Indiana. After the museum opened on February 1, 2000, it soon became recognized as the premier museum of African American history in Indiana. She serves as president of the society and curator of the museum."
Iowa,Nelson Evans,African American Meseum of Iowa,Civil Rights in Linn County,Nelson Evans,https://blackiowa.org/aiovg_videos/nelson-evans/,1960s-1997,2015,"Born in Chicago, Nelson Evans came to Iowa to attend Upper Iowa University. He grew to love Cedar Rapids after visiting the Oak Hill Jackson community with fellow classmates. After graduating in 1964, Nelson was hired by the Cedar Rapids Community School District and became its first African American teacher. Over the years, he rose in the ranks of the school system from teacher to principal and finally, the Executive Director of Elementary and Secondary School Education, a position from which he retired in 1998. He was inducted into the Iowa African-American Hall of Fame in 1997.

This video is from the oral history project “Civil Rights in Linn County,” conducted in 2015 with the assistance of a grant from the Linn County Historic Preservation Commission."
Kentucky,Jeffrey Hampton,Northern Kentucky University,Eva G. Farris Special Collections,"JEFFREY HAMPTON MANUSCRIPT ON AFRICAN AMERICAN EDUCATION IN COVINGTON, KENTUCKY",https://inside.nku.edu/library/find/unique-collections/special-collections-archives/alphabeticallist/jeffrey-hampton.html,1980s-2000s,2009,"Paper and digital typescript manuscript drafts for Leaving Children Behind: Black Education in Covington, Kentucky by Jeffrey Hampton and three handwritten transcripts of oral history interviews Hampton conducted during his research for the book."
Kentucky,Phyllis Mattingly,Kentucky Historical Society,Kentucky Oral History Collection,African American Heritage of Campbellsville and Taylor County Oral History Project,https://search.worldcat.org/title/798438274,N/A,2006,"Mattingly discusses growing up on a farm, her mother being the first black teacher hired, riding the school bus, school integration, Union Underwear closing, Joe's Dog & Suds, and segregated restrooms"
Kentucky,Audrey Grevious,The History Makers,Education Makers ,Audrey Grevious,https://www.thehistorymakers.org/biography/audrey-grevious-39,1940s,2002,Much of her career was divided between serving as principal at Kentucky Village and teaching in the Fayette County School District.
Kentucky,Sanford T. Roach,The History Makers,Education Makers ,Sanford T. Roach,https://sultan.tnstate.edu/search~S3?/X%22teacher%22+and+%22oral+history%22&searchscope=3&SORT=D/X%22teacher%22+and+%22oral+history%22&searchscope=3&SORT=D&SUBKEY=%22teacher%22+and+%22oral+history%22/37%2C165%2C165%2CB/frameset&FF=X%22teacher%22+and+%22oral+history%22&searchscope=3&SORT=D&37%2C37%2C,1960s,2002,"At Danville Bate as teacher and basketball coach, he compiled a 98-24 record. In twenty-two years as head coach at Lexington's all-black Paul Laurence Dunbar High School, he led the Bearcats to a 512-142 record. He retired from the sport when his first wife Mary died unexpectedly in 1965. He later became the first black principal of an integrated elementary school in Lexington and the first black principal of a Fayette County secondary school."
Kentucky,Roy M. Chappell,The History Makers,Education Makers ,Roy M. Chappell,https://sultan.tnstate.edu/search~S3?/X%22teacher%22+and+%22oral+history%22&searchscope=3&SORT=D/X%22teacher%22+and+%22oral+history%22&searchscope=3&SORT=D&SUBKEY=%22teacher%22+and+%22oral+history%22/49%2C165%2C165%2CB/frameset&FF=X%22teacher%22+and+%22oral+history%22&searchscope=3&SORT=D&53%2C53%2C,1940s-1980s,2002,"In 1945, Chappell was one of the black officers arrested for trying to integrate a segregated officers club in what would be known as the Freeman Field Mutiny. After the war, he became a teacher and guidance counselor in Chicago for thirty years. He retired in 1985."
Kentucky,Lyman T. Johnson,University of Louisville,Oral History Center,,https://ohc.library.louisville.edu/ohms/viewer.php?cachefile=167_johnson.xml#page-2,1976-1990,1976,"Topics include: African American educators; Segregation in higher education; Civil rights workers; African Americans--Education (Higher); Milburn, William S.; Race relations; University of Kentucky; Louisville Municipal College for Negroes (Louisville, Ky.)"
Kentucky,Charles Henry Parrish,University of Louisville,Oral History Center,,https://ohc.library.louisville.edu/ohms/viewer.php?cachefile=206-210_parrish.xml#page-3,1974-1977,1977,Topics include: KNEA and NEA; school desegregation in KY; higher education for Negroes; Louisville Municipal College; integraton of the University of Louisville
Kentucky,Woodford Porter,University of Louisville,Oral History Center,,https://ohc.library.louisville.edu/ohms/viewer.php?cachefile=223-224_porter.xml#page-8,1918-1977,1977,Porter discusses his learning experience in segregated schools and his time on the Louisville school board as a donor and proponent of educational equality for black students
Kentucky,Thomas Fountain Blue,University of Kentucky,Louie B. Nunn Center for Oral History––University of Kentucky Libraries,Black People in Louisville Oral History Project,,,1976,"No description provided, but likely includes Blue's commentary on the library sciences and early 20th century public library movement in Louisville"
Kentucky,Anne Braden,University of Louisville,Oral HIstory Center,,https://ohc.library.louisville.edu/ohms/viewer.php?cachefile=2002_001_13-15_braden.xml#page-1,"Civil Rights Period, mid-1950s-1960s",2001,"Braden speaks at length about her experiences as a provocateur for Civil Rights in Louisville, including her analysis on the the sense of community and quality of education in segregated black schools prior to desegregation"
Kentucky,Susan St. Clair Minor,University of Louisville,Oral History Center,,https://ohc.library.louisville.edu/ohms/viewer.php?cachefile=343_minor.xml,~1899-1968,1977,"St. Clair discusses her experiences graduating from Central Colored High School, attending Louisville Normal School (segregated, founded in 1890), and the responsibility black teachers acecpted to promote racial uplift among Negroes. "
Kentucky,Sarah C. Newby,University of Kentucky,Louie B. Nunn Center for Oral History––University of Kentucky Libraries,The African American Experience Oral History Project,https://kentuckyoralhistory.org/ark:/16417/xt7gqn5z8t7d,~1950s-1990s,1998,"Newby speaks to her experiences at Paul Laurence Dunbar (the segregated high school in Lexington, KY) and how the school prepared her to be among the first black students to integrate the University of Kentucky"
Kentucky,Eleanor Young Love,University of Louisville,Oral History Center,,https://ohc.library.louisville.edu/ohms/viewer.php?cachefile=646-647_love.xml,~1912-1970s,1978,"Eleanor, the daughter of Whitney Young Sr., speaks to the academic and cultural posture of the Lincoln Institute under her father's tenure as president at the school."
Kentucky,William H. Perry Jr.,University of Kentucky,Louie B. Nunn Center for Oral History––University of Kentucky Libraries,Black People in Louisville Oral History Project,https://kentuckyoralhistory.org/ark:/16417/xt7228050z52,N/A,1976,"Educator at Central Colored School beginning in 1877 and long time Secretary-Treasurer of the Kentucky Negro Educational Association, Perry's name and contributions are regularly listed in many of the mid-20th century KNEA journals. "
Kentucky,Ben Shobe,University of Louisville,Oral History Center,,https://ohc.library.louisville.edu/ohms/viewer.php?cachefile=2002_001_121-122_shobe.xml,~1941-1950s,1999,"Decorated NAACP lawyer and Kentucky native, Shobe details the particularly notable memory of seeing crosses burned by the KKK in Frankfort during his time as a student at Kentucky State University and more"
Kentucky,William Steward Nelson,University of Kentucky ,The Robert Penn Warren Oral History Archive,WILLIAM STUART NELSON,https://www.nunncenter.net/robertpennwarren/items/show/102,1895-1977,2002,"William Stuart Nelson (1895-1977), an African American educator and theologian, was born in Paris, Kentucky. After moving to Paducah, Kentucky and graduating from Lincoln High School, Paducah built and named a park after Nelson, Stuart Nelson Park, in the 1940s. During World War I, Nelson joined the Army and earned the rank of combat officer in the Second Army's 92nd division. In 1920, Nelson graduated from Howard University in Washington, D.C. with a bachelor of arts degree. In 1924, he graduated from Yale University with a bachelor of divinity degree. Nelson also studied in Paris, France at the Sorbonne and the Protestant Theological Seminary. In 1924, after graduating from Yale, Nelson began teaching philosophy at Howard University and became an assistant to the president. After leaving Howard, he became president of Shaw University in Raleigh, North Carolina and then became president of Dillard University in New Orleans. In 1940, Nelson returned to Howard to serve as dean and became vice president in 1961. While at Howard he started the Journal of Religious Thought and retired in 1968.

Nelson begins the interview by describing a recent trip to Africa and his discussion with an African political leader of Southern Rhodesia, [Sitole], regarding the nonviolence philosophy. Nelson furthers the discussion by providing his opinion on the strategy of nonviolence being used within the civil rights movement. African American history and the African American history movement are also discussed in terms of a social context. Nelson and Warren then revisit the influence of slavery on identity, discussing the white Southerner and his struggle to defend his identity within his culture. Nelson discusses the influence his travels had on his writings and his thesis expressing his opinion that is necessary for African Americans to view their problems in a world context. Nelson restates his interest in the philosophy of nonviolence and describes his participation in the nonviolent March on Washington in 1941. The interview concludes with a brief discussion of the effects of the civil rights movement on the youth who are devoted to it and Nelson's observations on the division in civil rights leadership."
Kentucky,James S. Way,Eastern Kentucky University,WILLIAM H. BERGE ORAL HISTORY CENTER,INTERVIEW WITH JAMES S. WAY,https://oralhistory.eku.edu/items/show/9144,N/A,1993,"A graduate of Bannaker High School in Cynthiana, KY, James Way obtained his Bachelor's degree from Wilberforce University and his Master's degree from EKU. Way began his teaching career in Cynthiana, eventually moving to EKU and becoming the first African American teacher at the University. He provides an overview of his family background and his active participation with many different boards and committees such as being the Chairman of Disciplinary Committee. Mr. Way discusses the black community in Richmond, KY, church, and retirement. He concludes the interview sharing memories of his youth."
Kentucky,Marian Tribble,Eastern Kentucky University,WILLIAM H. BERGE ORAL HISTORY CENTER,INTERVIEW WITH MARIAN TRIBBLE CURRY,https://oralhistory.eku.edu/items/show/9124,N/A,1992,"Marian Tribble Curry, a retired school teacher from Richmond City Schools discusses her educational background, her family background, and her church membership and activities. She speaks about the many social organizations in the African American community such as The Colored Ladies Art Club and the activities that take place at the Telford Community Center. Marian Curry concludes this interview by explaining her role and membership in several religious organizations and her participation in taking inventory at the Maple Grove Cemetery."
Kentucky,Virginia Shaw,Eastern Kentucky University,WILLIAM H. BERGE ORAL HISTORY CENTER,INTERVIEW WITH VIRGINIA SHAW,https://oralhistory.eku.edu/items/show/7723,N/A,1993,"Retired Teacher, EKU Alumni"
Louisana ,Llewellyn W. Williamson,University of Kentucky,Sue Eakin Louisiana History: Black History Oral History Project,Interview with Llewellyn Williamson ,https://kentuckyoralhistory.org/ark:/16417/xt718911r95t,N/A,1974,African American educators African American schools African Americans Arkansas Education John Williamson Dr. Llewellyn W. Williamson
Louisana ,Sarah Van Dyke,University of Kentucky,Sue Eakin Louisiana History: Black History Oral History Project,"Interview with Sarah Van Dyke, August 12, 1975",https://kentuckyoralhistory.org/ark:/16417/xt7gqn5z8v0v,N/A,1975,African American teachers African Americans Louisiana Social life and customs
Louisana ,George Baldwin,University of Kentucky,Sue Eakin Louisiana History: Black History Oral History Project,Interview with George Baldwin,https://kentuckyoralhistory.org/ark:/16417/xt7n028pg59d,N/A,N/A,African Americans Education Louisiana social conditions
Louisana ,Dr. Tom Arceneaux,National Endowment for the Humanities,Historians of Louisana Project ,Dr. Tom Arceneaux,https://nwla-archives.org/guide/oha.htm,N/A,1979,Tom Arceneaux was a teacher in West Baton Rouge Parish who directed a program for students to interview their family members and members of their community about each student’s personal heritage.
Louisana ,Herman Carter,Stanford,Stanford Digital Repository,Oral history interview with Herman Carter,https://purl.stanford.edu/dh125pj7047,N/A,1965,"Oral history interview with Herman Carter, African-American, male, Member of SSOC and possibly SNCC, working for CORE, 0213 (side 1), Baton Rouge, Louisiana. 0213"
Louisana ,Fidelia Johnson,Havard Radcliffe Institute ,Schlesinger Library on the History of Women in America ,,https://guides.library.harvard.edu/schlesinger_bwohp,1900-1970,1979,"Teacher in rural schools of Louisiana; involved at local and national level in National Education Association and other teacher associations; her father was founder of Grambling State University, and she taught there for a while."
Louisana ,George E. Mencer,Lousiana State University,,"George E. Mencer, Jr. oral history interview, 1995",https://search.worldcat.org/title/907959597,1946-1970,1995,"Mencer recalls his time as a student at McKinley High School from 1933 to 1937 and his experience as a P.E. teacher and coach at the school from 1946 to 1960. He discusses high schools for African Americans in the Baton Rouge area; his career as a teacher, coach, and principal; and notable teachers and graduates of McKinley"
Louisiana,J.K. Haynes,University of Louisiana at Lafayette,,"Haynes, J.K. ( - ). Interview, 1976",https://archivesspace.louisiana.edu/repositories/2/archival_objects/42940,N/A,1976,"Typescript of interview of J. K. Haynes, Executive Secretary of the Louisiana Education Association by Doris White, USL graduate student."
Louisiana,"Albert Charles Odell, Sr. ",Louisiana State University,Louisiana and Lower Mississippi Valley Collections,McKinley High School Oral History Project,https://search.worldcat.org/title/907959600,1940s-1990s,1998,"Odell touches on many topics in this interview, including the politics of the Louisiana State Board of Education, being the first black teacher in Torrance, California..."
Louisiana,Armond Brown,Louisiana State University,Louisiana and Lower Mississippi Valley Collections,McKinley High School Oral History Project,https://search.worldcat.org/title/104625430,1967-2002,2002,"Armond Brown born April 14, 1954; went to Capital High, a McKinley High rival; was asked to
leave Belaire for McKinley High; came to McKinley high as an Athletic Director and Head
football coach under Principal Charlie Thomas from January to May; was offered Assistant
Principal position during the summer; attended Southern University as a linebacker on the football
team from 72'-76'; did not get drafted for professional football and fell back on education; taught at
Scotlandville High School; left during Scotlandville switch to Magnet status due to loss of
football program; went to Belaire High School then to McKinley; richness of South Baton Rouge;
working for Mr. Sampson Carroll; the youth not knowing the richness; losing the traditions that
used to be passed down; South Baton Rouge’s great pastors, like Rev. Charles T. Smith and T. J.
Jemison; enjoying the Ann and Temple Theatres; being connected with the McKinley Oral History
project since he was Asst. Principal at McKinley; supports the project due to his learning more
about the South Baton Rouge community through the process; the project impacts the community
by connecting the generations; McKinley High has positive involvement; the students gain a sense
of community; personally enjoying seeing the seasoned people talking to the students; hesitant and
not knowing what to expect from the Oral History project; wanting to know why, how, and to what
extent the histories would be collected; no misinterpretations with the project's goals or ideas;
suggesting interviewing George W. Eames"
Louisiana,Charles Vincent,Louisiana State University,McKinley High School Oral History Project – History of McKinley High School,Charles Vincent,https://liblegacy.lsu.edu/sites/all/files/oralhistory/abstracts/mckinley/5_social/Vincent_Charles_T3192.abs.pdf, 1860s-1960s,1995,"Born in Hazlehurst, Mississippi, October 19, 1945; currently lives in Baker, Louisiana; has lived in Baton Rouge area since 1966; South Baton Rouge is a very dynamic, diverse, progressive community; Vincent teaches history at Southern University; blessed with wonderful family; death of Emmett Till made him face raw racism; educational background; has three children with wife Delores; treating whites with deference while growing up in Southwest Mississippi; witnessing a policeman kill an African American man in 1957; more on Emmett Till murder; desegregation efforts of 1967; whites not understanding why he was dissatisfied with the way they treated him; his family tried to stay away from whites when possible; Vincent is currently more optimistic about the integrity of police than he was in 1960s; incidents with police on Southern University campus in late 1960s; North Street incident of 1972; has always favored nonviolence as more Christ-like; mourns violent deaths of African American leaders in fifties and sixties; everyday racism while Vincent was an LSU student; 1972 incident at Southern where two students were killed by police; police force exonerated; faculty support of students at Southern; turbulent era from 1968 to 1972; birth of a faculty senate at Southern that had a say in the administration at the university; Southern president Jesse Stone more aware of students’ concerns than his predecessors; after such a tragic incident, people think of how to prevent future tragedies."
Louisiana,Eunice Paddio-Johnson,Louisiana State University,,Eunice Paddio-Johnson,https://www.lib.lsu.edu/sites/all/files/oralhistory/abstracts/civilrights/Paddio-Johnson_Eunice.pdf,1940s-1970s,1998,"Eunice Paddio-Johnson discusses her memories of racism as a child and as an adult, her education and teaching in segregated schools in Saint Helena Parish, efforts to register black voters, her experience as the first black member of the Saint Helena Parish School Board, the roles of the Freemasons and Order of the Eastern Star in the civil rights movement, the Louisiana Education Association, and her work with various civic associations."
Louisiana,Clarence Marie Collier Audio Interview,East Baton Rouge Parish,Remembering the Struggle and the Where Were You When....? Oral History Project.,Clarence Marie Collier Audio Interview,https://batonrougedigitalarchive.contentdm.oclc.org/digital/collection/p15196coll3/id/24/rec/8,1960s-1970s,1983,"Clarence Marie Collier was born in St. Francisville, Louisiana but moved to Baton Rouge, Louisiana when she was 2.  She attended McKinley High School and went on to attend Southern University where she studied science and education.  She  went on to teach in Ascension and East Baton Rouge Parish School systems and served as the Principle of the newly constructed Park Elementary School and later as a Supervisor for the Parish.  She was an executive member of the Baton Rouge NAACP and the Black Teachers Association through the Louisiana Education Association.  She later took on the position of System Vice President of Student Affairs and Community Services at Southern University in 1975.   She retired in 1985."
Louisiana, George W. Jr. Gore,Fisk University,Fisk University Oral History Collection: OH 119 Archives Range 9 Cabinet 2,,https://www.fisk.edu/wp-content/uploads/2020/06/Fisk_Oral_History_Collection1.pdf,N/A,1972,Discusses the discriminatory practices of the National Teacher Association prior to the 1950's and the growth of higher education for black people in Tennessee.
Louisiana,"Halson V. Eagleson, ",Fisk University,Fisk University Oral History Collection: OH 145 (sides I & II & III) Archives Range 9 Cabinet 2,,https://www.fisk.edu/wp-content/uploads/2020/06/Fisk_Oral_History_Collection1.pdf,N/A,1972,Talks about the influences on his career and his rewarding experiences as a teacher
Louisiana, James A. Emanuel,Fisk University,Fisk University Oral History Collection: OH 123 (side 1) Archives Range 9 Cabinet 2,,https://www.fisk.edu/wp-content/uploads/2020/06/Fisk_Oral_History_Collection1.pdf,N/A,1972,"Discusses his experiences as a teacher and his interest in class struggles among workers as well as his interest in black culture including poetry, academics, films, aesthetics, genocide and politics. (see Side A for OP tape #38 by Emanuel that includes ""The Poetry of Paul Lawrence Dunbar"")"
Louisiana,O.C.W. Taylor,Columbia University,Columbia Center for Oral History ,"Oral history interview with O. C. W. Taylor, 1971.",https://oralhistoryportal.library.columbia.edu/document.php?id=ldpd_13479908,1915-1970,1971,"In his 1971 interview with Henry La Brie III, Taylor discusses the origins, cost, circulation, and profitability of the Louisiana Weekly. He describes the various jobs he held, including employment with the Pittsburgh Courier, the Associated Press, WNOE radio, WWOM-TV, and the New Orleans public school system. Other topics of discussion include: what people want to see in the news; the successes and challenges of the black press; the contributions of the black press to the civil rights movement; memories of a lynching Taylor witnessed as an adolescent; and Taylor's predictions for the future of the black press."
Lousiana ,F. Paul Augstin,University of Kentucky,Sue Eakin Louisiana History: Black History Oral History Project,"Interview with F. Paul Augustin, December 14, 1970",https://kentuckyoralhistory.org/ark:/16417/xt72z31nk037,NA,1970,African Americans High school principals history Louisiana Segregation in education
Lousiana ,Unknown,University of Kentucky,Sue Eakin Louisiana History: Black History Oral History Project,Interivew with Unknown,https://kentuckyoralhistory.org/ark:/16417/xt7mcv4brw0k,N/A,1979,African American clergy African American educators African American Lutherans Louisiana
Lousiana ,Sidak,University of Kentucky,Sue Eakin Louisiana History: Black History Oral History Project,"Interview with Sidak,",https://kentuckyoralhistory.org/ark:/16417/xt7sf7666z5b,N/A,N/A,Education Race relations African Americans
Lousiana ,Ida Hines,University of Kentucky,Sue Eakin Louisiana History: Black History Oral History Project,"Interview with Ida Hines, September 11, 19??",https://kentuckyoralhistory.org/ark:/16417/xt7x3f4kq04j#,N/A,N/A,African American schools African Americans Education Louisiana
Lousiana ,Marius Benjamin,University of Kentucky,Sue Eakin Louisiana History: Black History Oral History Project,,https://kentuckyoralhistory.org/ark:/16417/xt7c599z313b,N/A,1975,African American schools African Americans Louisiana
Lousiana ,Fedelia Johnson ,Harvard University ,Black women Oral Project ,Fedelia Johnson Oral History Project ,https://iiif.lib.harvard.edu/manifests/view/drs:45172383$1i,1976-1981,N/A,DIscusses the life of Ms. Fedelia Johnson and her life as a teacher in the rural schools of Lousiana
