State,Participant Name,Institution,Collection,Project Title,Link,Years Covered,Year of Interview,Project Overview
Alabama,Joe Reed,George Washington University,"Special Collections Research Center, The George Washington University Repository",NEA Collection (Joe Reed Interview),https://searcharchives.library.gwu.edu/repositories/2/archival_objects/262189,1954-2011,2008,Joe Reed's experience with the NEA during merger with Alabama Education Association as Alabama State Teachers Association subsumed.
Alabama,Hannah H. Thomas,Atlanta University Center : The History Makers,The HistoryMakers video oral history with Hannah H. Thomas.,HistoryMakers (Video oral history collection),https://www.thehistorymakers.org/sites/default/files/A2005_065_EAD.pdf,1920,2016,"Civic activist and educator Hannah H. Thomas was born in Florence, Alabama on December 25, 1916. Daughter of Evernee Hubbard and Everett N. Hawkins, Thomas was the eighth of ten children. She graduated from the Burrell High School in Florence, Alabama in 1939. She earned her B.S. degree in education from Alabama A&M University in 1951 and her M.S. degree in education from the University of Cincinnati in 1964. Thomas taught school for more than ten years in Alabama, and was named Teacher of the Year in 1956. She migrated to Cincinnati in 1958, and taught in the public schools of that community for twenty-two years. Thomas officially retired from teaching, continued to work as an educator, and founded Cincinnati's African American Heritage Day and the Sojourner Truth Drama group. She has received numerous awards including Cincinnati Enquirer's Woman of the Year Award in 1992"
Alabama,Joe L. Reed (1938-),"United States District Court, Middle District of Alabama",Oral Histories Project,Joe L. Reed,Part 1 ; Part 2,1940s-present,2021,"Discusses life in Alabama, schools, civil rights, and Alabama State Teachers Association, including merger. "
Alabama,Lucille Summers (1912-,"University of Alabama, Birmingham - Mervyn H. Sterne Library",University of Alabama in Birmingham Oral History Research Project,Forty years of Black education in the South : [Lucille Summers memoir],https://uab.contentdm.oclc.org/digital/collection/oralhistory/id/509/rec/1,1980,1980,"Lucile Summers, retired Black teacher, remembers what segregation was like when she was growing up and recalls her experiences in teaching in both segregated and integrated schools"
Alabama ,Willie Mae Lee Crews,"University of North Carolina at Chapel hill
Chapel Hill: Center for the Study of the American South",Oral Histories of the American South: The Civil Rights Movement,"Oral History Interview with Willie Mae Lee Crews, June 16, 2005. Interview U-0020. Southern Oral History Program Collection (#4007).",https://docsouth.unc.edu/sohp/U-0020/menu.html,1930s-1980s,2005,"Willie Mae Lee Crews was born into a sharecropping family in Marion, Alabama, during the 1930s. She describes her childhood as impoverished, but stresses that she was instilled with a strong work ethic by her close-knit family. During the 1950s, Crews attended Dillard University in New Orleans on scholarship and then continued her education at the graduate level at Fisk University in Nashville. As a graduate student in sociology, Crews was sent to Montgomery, Alabama, to interview participants in the bus boycott. By the early 1960s, Crews had become a teacher. She describes her work at Hayes High School, an African American school in Birmingham, during the 1960s and 1970s. Crews first started teaching at Hayes in 1963; she describes it as an excellent segregated school with strong leadership and high standards for its students. Crews was still teaching at Hayes in 1970-1971 when Birmingham schools were desegregated. Here, she focuses more on efforts to integrate faculty rather than on efforts to integrate students. She describes how the school district transferred teachers in a way that favored white teachers and schools to the detriment of students at schools like Hayes. Crews also discusses the role of segregated housing in creating what she calls a ""projects mentality."" Social trends such as this, along with ineffective policies and the influx of poorly trained teachers, were to blame for the deterioration of integrated schools. In particular, she laments the disappearance of teaching philosophies that had stressed teaching students integrity, social responsibility, and self-confidence that had characterized Hayes High School prior to desegregation."
Arizona,Jefferson Eugene Grigsby ,The History Makers,Education Makers ,HistoryMakers (Video oral history collection),https://www.thehistorymakers.org/sites/default/files/A2007_204_EAC.pdf,1920s,2007,"Artist and professor Jefferson Eugene Grigsby was born on October 17, 1918, in Greensboro, North Carolina. Grigsby received his B.A. degree from Morehouse College in Atlanta, Georgia; his M.A. degree in art from Ohio State University in Columbus, Ohio; and his Ph.D. from New York University in New York, New York. In 1946, Grigsby began working as an art teacher at Carver High School in Phoenix, Arizona; in 1954, he moved to Phoenix Union High School. In 1958, Grigsby taught art at the Brussels World Fair. While working at Arizona State University, Grigsby published Art and Ethics: Background for Teaching Youth in a Pluralistic Society. It was the first book ever written for art teachers by an African American artist and author. Grigsby was on the boards of numerous organizations, including the National Art Education Association. Grigsby passed away on June 9, 2013, at the age of 94."
Arizona,Veora Johnson,University of Denver ,A Sound Model Digital Archive,"Oral history interview with Ms. Veora Johnson, 2001 April 19, 2006 Marc",https://duarchives.coalliance.org/repositories/2/archival_objects/146971,N/A,2001,"Johnson details her education in Texas and tells of her move to Mesa, Arizona, to teach public school. She discusses the history of the Mesa school system during segregation and after. She describes when the schools were integrated and what it was like being the first African American teacher at the Irving School. Johnson also gives some history of the Washington area and talks about race relations in Mesa."
Arizona ,Annie Watkins ,Northern Arizona Univeristy,Los Recuerdos del Barrio en Flagstaff;,,http://archive.library.nau.edu/digital/collection/cpa/id/116178/,N/A,2014,"In this oral history interview, Flagstaff resident and retired teacher, Annie Watkins, describes her childhood in Louisiana and daily life on the family farm. She also talks about being newly married and coming to Flagstaff to pursue an education degree. Annie recounts the various teaching positions that she held and the discrimination she experienced as an African-American in Flagstaff."
Arkansas,Lula Mae Ford,The History Makers,Education Makers ,HistoryMakers (Video oral history collection),https://www.thehistorymakers.org/biography/lula-ford-41,1965-2008,2008,"In 1965, Ford began teaching at Horner Elementary School. She resigned in 1979, to become a liaison for parents and the principal selection committee as the ESEA reading teacher and coordinator. Ford later served as principal of Beethoven Elementary School and was awarded the principal of excellence award for her performance in 1992, 1993 and 1994."
Arkansas,Mr. Jones [no first name was given],University of Arkansas ,Land of (Unequal) Opportunity: Documenting the Civil Rights Struggle in Arkansas,"Oral History Interview with Teacher in Segregated School
",https://digitalcollections.uark.edu/digital/collection/Civilrights/id/1532/,N/A,1977,"An interview a Mr. Jones [no first name given] about his experiences teaching in Arkadelphia, Arkansas segregated school system"
Arkansas,Evangeline Brown,Univeristy of Central Arkansas,Oral Histories: Delta Project,Interviewee: Evangeline Brown,https://uca.edu/archives/delta-project-history/,1940s-1980s,1994,"Life story of Evangeline Brown focusing on her experience as a teacher and civil rights. Brown tells of the events of her forty-four years of teaching in both segregated and integrated schools in the south during the Civil Rights Movement.

"
Arkansas,Mary Jeffers,Univeristy of Central Arkansas,Oral Histories: Delta Project,Interviewee: Future and Mary Jeffers,https://uca.edu/archives/delta-project-history/,1940s-1980s,1994,"Life of Mary Jeffers focusing on the Civil Rights Movement. The interview focuses on Mary Jeffers’ years as a teacher at Stewart Elementary School in the Forrest City School District and describes how the faculty coped with integration.
"
Arkansas,Christine Johnson,History Colorado,History Colorado -- Colorado Black Voices,"Oral history interview with Christine Johnson, AR.OH.703",https://soundcloud.com/historycolorado/oral-history-interview-with-christine-johnson-aroh703?in=historycolorado/sets/colorados-black-voices&utm_source=clipboard&utm_medium=text&utm_campaign=social_sharing,N/A,1977,"Johnson recounts her childhood in Little Rock, Arkansas, and her later career as a teacher. This oral history was collected as part of the African American Advisory Council."
Arkansas,Vivion Brewer,Central Arkansas ,Butler Center for Arkansas Studies ,"Brewer, Vivion oral history",https://arstudies.contentdm.oclc.org/digital/collection/p1532coll1/id/13210/rec/4,N/A,1978,Describe her work to help the African-American community in Scott (Ark.)
Arkansas,Robbie Dell Robinson,Univeristy of Central Arkansas,Oral Histories: Delta Project,Interviewee: Robbie Dell Robinson,https://uca.edu/archives/delta-project-history/,N/A,1995,Life story of Robbie Dell Robinson focusing on teaching and civil rights. Robinson tells of the lives of her and her children and how the Civil Rights Movement affected them in the 1960’s and 1970’s. Robinson tells of the events of this time period from her perspective as a teacher.
Arkansas ,Robert Carter ,National Park Service ,Brown v. Board of Education National Historical Park,Oral History Interview with Robert Carter,https://www.nps.gov/articles/000/oral-history-interview-with-robert-carter.htm,1940-1960,2001,"Brown v. Board Oral History Collection, Supreme Court case interviews. Interviewee: Judge Carter; Interviewer: [unintelligible 00:21] with the National Park Service. Interview conducted in the chambers of Judge Carter in Manhattan, New York, on August 7, 2001. These interviews are made possible through the Brown v. Board Oral History Research Project funded by the National Park Service for the Summer of 2001 as part of the Brown v. Board of Education National Historic Site Oral History Project."
California,Shirley Hasley,Mill Valley Public Library,,Oral History of Shirley Hasley,https://search.worldcat.org/title/The-HistoryMakers-video-oral-history-with-Shirley-Kinsey/oclc/1000519340,1960s,2007,"In this oral history interview, beloved elementary school teacher Shirley Hasley discusses not only her 38-year career in Mill Valley, but the people, experiences and attitudes that helped shape her steadfast convictions."
California,Alonso Radford,"University of California, Berkeley",Regional Oral History Office,"Pioneer black teacher at Albany High School : oral history transcript / 1982. / Alonso Radford ; tape recorded interview conducted by Catherine J. Webb in 1982,","https://search.library.berkeley.edu/discovery/fulldisplay?docid=alma991043351869706532&context=L&vid=01UCS_BER:UCB&lang=en&search_scope=MyInstitution&adaptor=Local%20Search%20Engine&tab=Everything&query=any,contains,26650064&offset=0",N/A,1982,Pioneer black teacher at Albany High School
California,Ida Louise Jackson,"University of California, Berkeley",The University of California Black Alumni Series,"Ida Louise Jackson
Overcoming Barriers in Education",https://oac.cdlib.org/view?docId=hb138nb0z7&brand=calisphere&doc.view=entire_text,1920s-1970s,1990,"Jackson's experiences of an African American student at the University of California, 1918-1923, founding of Alpha Kappa Alpha sorority; teaching in Oakland and El Centro, California; doctoral studies, Columbia University; dean of women, Tuskegee Institute; establishing summer teaching and health institutes in Mississippi; racial discrimination at the UC Berkeley and elsewhere; other family and community recollections."
California,Shirley Kinsey,The History Makers,Education Makers ,Shirley Kinsey,https://endeavor.flo.org/vwebv/search?searchCode1=GKEY&searchType=2&argType1=any&searchArg1=1000519340,1960s-2000s,2016,"This life oral history interview with Shirley Kinsey was conducted by Larry Crowe on December 18, 2013, in Pacific Palisades, California, and was recorded on 7 uncompressed MOV digital video files. Art collector, educator, and Shirley Kinsey (1946 - ) and her husband, Bernard Kinsey, were the owners and curators of an extensive collection of African American art, books and manuscripts. She co authored The Kinsey Collection: Shared Treasures of Bernard and Shirley Kinsey, which was a companion book to the exhibit of the same name."
California,Jean Ficklin,Biblioboard,,Jean Ficklin: An Oral History,https://library.biblioboard.com/anthology/d3dc0a1b-da2a-43a5-b3c8-bcdce8a03cf7/content/masonry/all-content,1960s,2021,https://library.biblioboard.com/anthology/d3dc0a1b-da2a-43a5-b3c8-bcdce8a03cf7/content/masonry/all-content
California,Jewelle Taylor Gibbs,"University of California, Berkeley",Regional Oral History Office,AN ORAL HISTORY WITH JEWELLE TAYLOR GIBBS,https://digitalassets.lib.berkeley.edu/roho/ucb/text/taylor_gibbs_jewelle.pdf,1940s-1990,2005,"Jewelle Taylor Gibbs started as assistant professor at the University of California School of Social Welfare in 1979, became an associate professor in 1983, a full professor in 1986, and was appointed to the endowed chair as Zellerbach Family Fund Professor of Social Policy, Community Change and Practice in 1993, a position she held until her retirement in 2000. During these years Professor Gibbs wrote influential articles and books on a wide range of topics including minority mental health, young black men in America, and the O.J. Simpson and Rodney King cases; she was a visiting scholar in the United States and abroad; and she mentored a generation of students and faculty. She received the highest academic honor at the University of California, the Berkeley Citation, and testified before Congress. Professor Gibbs had returned to graduate school when her sons were in high school; her life has followed a trajectory instructive and inspirational for women who raise their families and occupy careers which impact the public sphere in significant ways."
California,Ruth Acty,Berkeley Historical Society, OH--Acty,"Ruth Acty, first African American teacher in the Berkeley Unified School District : oral history transcript",https://oac.cdlib.org/findaid/ark:/13030/c82n56zm/entire_text/,N/A,1994,"Educator, author, and actor Ruth Acty (1913-1998) was the first African American teacher hired by the Berkeley Unified School District in 1943. Born Oakland, California in 1913 to John and Gussie (née Stokes) Acty, she was raised in West Oakland and graduated from McClymonds High School before earning an A.B. in English from San Francisco State College in 1937. After taking classes in early childhood development and speech at the University of California, Berkeley, she attended Northwestern University earning a M.A. in Theater in 1941."
California,Norma Norman,"University of Nevada, Las Vegas",Public School Principalship Oral History Project,Norma Norman oral history interview (OH-01393),https://special.library.unlv.edu/ark%3A/62930/f1277s,N/A,2004,"Oral history interview with Norma Norman conducted by Dorthy Richardson-Martin on November 30, 2004 for the Public School Principalship Oral History Project. In this interview, Norman reflects upon her experience as an elementary school administrator in California’s Hayward Unified School District. She discusses her experience as a female African American teacher in the 1960s and 1970s, and how those experiences shaped her approach to school administration. She also discusses school district programs and policies, and how such programs impact different populations of students."
Colorado,Marie Louise Greenwood,The History Makers,Education Makers,Marie Louise Greenwood,https://www.thehistorymakers.org/biography/frances-hooks-41,1930s-2000,2016,"After receiving her letter of assignment to teach at Whittier Elementary School in 1935, Greenwood became one of the first African American school teachers in Denver."
Colorado ,De Laris Carpenter,Boulder Public Library,Carnegie Library for Local History-- Oral History Collection,"Transcript: Oral history interview with De Laris Carpenter, 2001",https://localhistory.boulderlibrary.org/islandora/object/islandora%3A24507,1936-2001,2001,"De Laris Carpenter talks about her upbringing in Mississippi; her life in 
Boulder; her career as a teacher, counselor, and administrator; and the role of family in 
her life, addressing both her own childhood and her role as a parent. Throughout the 
interview, she discusses the African American community and interactions of the white 
and African American communities, including discussion of racism in Boulder, at the 
University of Colorado-Boulder, and in the Boulder Valley Schools"
Delaware,Littleton Mitchell,The History Makers,Education Matters,"The HistoryMakers® Video Oral History Interview with Littleton Mitchell,",https://www.thehistorymakers.org/sites/default/files/A2005_267_Mitchell_Littleton_EAD.pdf,N/A,N/A,"Association branch executive, civil rights activist, and Tuskegee Airman Littleton Purnell Mitchell was born in the 1920s in Milford, Delaware, to Helen Ann Purnell and George Darnell Mitchell. His advocacy began at age thirteen, when he joined the National Association for the Advancement of Colored People (NAACP). During the late 1930s, he attended Howard High School, the state’s only high school for African Americans. Upon graduation, he spent two years at West Chester University of Pennsylvania on a track scholarship before joining the Tuskegee Airmen during War World II. While he was there, he witnessed the building of the airfield at Tuskegee in 1941. He taught future pilots the art of instrument flying. His duties sent him to the Link Trainer Facilities and Schools in New York, and Chanute Field in Chanute, Illinois, as well as the Base Instrument Command Flying School in Texas. In February 1946, he was discharged from the U.S. Army. Encouraged by his fellow Tuskegee Airmen, Mitchell returned to college, and earned his degree from West Chester University of Pennsylvania and began a career in the psychiatric treatment of children and civil rights advocacy.
Mitchell led the Delaware State Branches of the NAACP as president for over thirty years until 1991. During his years there, he led their efforts to secure fair housing, equal access to public accommodations, and equal education and employment opportunities for Delaware’s African American community. He became the first African American teacher of white children at Governor Bacon Health Center in Delaware City. He retired from teaching in 1984. His wife, Jane Mitchell, now deceased, became one of Delaware’s first African American nurses. For many years, she served as the director of nursing at the Delaware State Hospital and along with her husband led efforts to desegregate the state’s hospitals.
file:///C|/Users/dj/Desktop/New%20folder%20(2)/EAD/A2005_267_Mitchell_Littleton_EAD.html[4/26/2012 4:38:03 PM]
Finding Aid to The HistoryMakers® Video Oral History with Littleton Mitchell
Mitchell served on the Delaware Humanities Council from 1991 to 1997. In 1993, the University of Delaware awarded Mitchell its Medal of Merit for sustained community service. He was also awarded the Delaware Bar Association’s 2004 Liberty Bell Award for community service. For the Brown v. Board of Education 50th Anniversary Commission, he served as a presidential appointee representing Delaware.
Mitchell resided in Delaware City, Delaware, with his family until his death on July 6, 2009. Littleton Purnell Mitchell was interview by the HistoryMakers on December 19, 2005."
Delaware,Dr. Joseph E. Johnson,Delaware Historical Society Research Libary,Voices of the Elders: Stories of African Americans in Delaware,Dr. Joseph E. Johnson,https://www.youtube.com/watch?v=9bEL-UYedHc,1950s-1990s,2015,"A project of the Delaware Historical Society’s Center for African American Heritage, the Wilmington City Council and WITN-TV 22, the Voices of the Elders documents African-American leaders in Delaware. 

Throughout 2015, a new figure will be highlighted in a documentary to be screened at the Society. February’s film will feature the life and career of Dr. Joseph E. Johnson with the film Dr. Joseph Johnson: African American Educator. Future interview subjects will include Dr. Lozelle Deluz, Canon Lloyd S. Casson, James Gilliam, Sr., George Wright, Jr. and Esthelda Parker Selby.
Dr. Johnson’s career in public school administration began at Warner Junior High School in Wilmington. In 1968, he became principal of P.S. DuPont High School—the first African-American principal of a non-segregated institution. He was the last superintendent of the Wilmington Public Schools and then the first superintendent of the Red Clay School District, where he remained until his retirement in 1990.

As a school administrator, Dr. Johnson advocated for equal access to quality education for all students during the desegregation of Delaware’s public schools. He consulted on the Evans vs. Buchanan case as well subsequent federal efforts to desegregate public schools. He worked closely with civil rights lawyer Louis L. Redding and Judge Leonard Williams to address issues of educational disparity in Delaware.

In addition to his civil rights work in the educational system, Dr. Johnson has been an invaluable part of Wilmington’s community. He has served on the boards of the Walnut Street YMCA, the Delaware Historical Society and the Delaware Humanities Council. Currently, Dr. Johnson is president of the Redding House Foundation, which aims to preserve and continue Louis L. Redding’s legacy. In 2014, Dr. Johnson was honored with the Delaware Barristers’ Association’s “Excellence in Education Award.” He is also an active member of the Episcopal Church of Saints Andrew and Matthew."
Delaware,Esthelda Parker-Shelby,Delaware Historical Society Research Libary,Voices of the Elders: Stories of African Americans in Delaware,Dr. Joseph E. Johnson,https://www.youtube.com/watch?time_continue=175&v=3FVI_ROLzng&embeds_referring_euri=https%3A%2F%2Fdehistory.org%2F&source_ve_path=Mjg2NjY&feature=emb_logo,N/A,2015,"Esthelda Parker-Selby's educational leadership and political career with the film Esthelda ""Stell"" Parker Selby: Educator and Politician."
Florida,Camilla Thompson (1922-2022),The History Makers,"ScienceMakers
CivicMakers",CAMILLA THOMPSON,https://www.thehistorymakers.org/biography/camilla-thompson-41,1925-1960s,2006,"Educator and newspaper columnist Camilla Bolton Perkins Thompson was born on March 6, 1922 in Jacksonville, Florida. Thompson taught chemistry, physics and math at four Jacksonville junior and senior high schools."
Florida,"Bethune, Mary McLeod (1875-1955)",Bethel University ,Black Americans of achievement video collection II.,,"https://libsearch.bethel.edu/discovery/fulldisplay?vid=01CLIC_BETHEL:BETHEL&search_scope=CLIC_and_BETHEL_ALL_Profile&tab=CLIC_and_BETHEL_ALL_Slot&docid=alma991002092299703686&lang=en&context=L&adaptor=Local%20Search%20Engine&query=sub,exact,United%20States%20--%20Race%20relations,AND&mode=advanced",Varies,1994,Chronicles the life of educator Mary McLeod Bethune.
Florida,Ollie M. Taylor,The History Makers/Howard University,Education Makers,OLLIE TAYLOR,https://www.thehistorymakers.org/biography/ollie-taylor,1960s-1980s,2016,"In 1964, Taylor worked as a file clerk for Spiegel in Chicago and obtained her A.A. degree from Kennedy King College in Chicago. In 1975, she began her career as an Elementary School teacher for the Chicago Board of Education."
Florida,Ceclia Watson,Univeristy of Florida ,UF Samuel Proctor Oral History Program,Interview with Cecelia Watson and Eddie Salters,https://original-ufdc.uflib.ufl.edu/AA00064809/00001/citation,N/A,2018,"In this interview, interviewer Julian Valdivia sits down with Eddie Salters and Cecelia Watson, two longtime African American residents of Fort Myers. Salters recalls that he moved to Fort Myers to finish his schooling at Dunbar, while Watson became involved in the community through her sorority, Sigma Gamma Rho, American Legion, church, and the Dunbar School. They both recalls spending recreational time at Bunche Beach, an area designated for use by African Americans under Jim Crow. Watson went on to attend South Carolina Allen University, where she earned a degree in elementary education. She went on to become the first Black teacher at Elba Elementary in Alabama. The two also discuss local efforts to organize against integration, pointing to Friendship Baptist Church as the primary organizer of the local Black community in Fort Myers. They recall supporting local politician Veronica Shoemaker on her successful effort to win election to the city council. Her success was significant because it came in spite of considerable barriers to Black political participation imposed around elections such as limited voting locations and times. They then recount the horrific lynching of a young Black boy accused of the rape of a White girl and its psychological impact on the local Black community. They conclude with a discussion of the various means employed by White Supremacists to justify brutal acts of violence against African Americans."
