State,Participant Name,Institution,Collection,Project Title,Link,Years Covered,Year of Interview,Project Overview
New Jersey,Frances Grant,Harvard University: Schlesinger Library,Black Women Oral History Project,"Frances Grant (1895-1982), New York, New York. Interviewed by: Maurine P. Rothschild, October 7, 8, 15, and 21, 1977.",https://hollisarchives.lib.harvard.edu/repositories/8/archival_objects/2485344,N/A,1977,"Teacher, Bordentown (New Jersey) Manual Training School, and Fieldston School, New York City; also librarian."
New York,Jean Wiley,Columbia University,Oral history interview with Jean Wiley,,https://search.worldcat.org/title/1244480858,N/A,2002,"In this interview with Sheila Michaels, Jean Wiley discusses Baltimore's Black community, her activism, and her early teaching career."
New York,Lionel McMurren,The History Makers,Education Makers ,Lionel McMurren,https://www.thehistorymakers.org/biography/lionel-mcmurren-39,1950s-1980s,2003,"McMurren began teaching in 1954, at the same junior high that he had attended, Frederick Douglass. He spent most of his career there, eventually serving as principal for thirteen years."
New York City,Jessie Gladden,The History Makers,Education Makers ,Jessie Gladden,https://sultan.tnstate.edu/search~S3?/X%22teacher%22+and+%22oral+history%22&searchscope=3&SORT=D/X%22teacher%22+and+%22oral+history%22&searchscope=3&SORT=D&SUBKEY=%22teacher%22+and+%22oral+history%22/25%2C165%2C165%2CB/frameset&FF=X%22teacher%22+and+%22oral+history%22&searchscope=3&SORT=D&25%2C25%2C,1950s-19992,2004,"Between 1956 and 1972, Gladden taught in Baltimore City Public Schools, taking time off to raise her family."
North Carolina,Septima Poinsette Clark,University of North Carolina,Southern Oral History Program Collection,"Interview with Septima Poinsette Clark, July 25, 1976.",https://docsouth.unc.edu/sohp/G-0016/G-0016.mp3,1900s-1950s,1976,"Septima Clark was a teacher and citizen's education director for the Highlander Folk School and Southern Christian Leadership Conference. She also worked with the South Carolina Council on Human Relations, YWCA, and American Friends Service Committee. This interview covers her childhood in Charleston, South Carolina, and her family's efforts to survive poverty and racial prejudice. Her mother was a washerwoman reared in Haiti, and her father was a former slave on the Poinsette plantation. Her first job as a teacher on John's Island from 1916 to 1919 led to her early activism with the NAACP, her friendship with Judge and Mrs. Waring, and her work with the Charleston YWCA. She married Nerie David Clark as an act of rebellion against her parents, but she chose not to remarry after his early death. She attended college in Columbia, returned to Charleston in 1947, and lobbied for the first local credit union to serve black workers. After she lost her teaching position in 1956 due to her NAACP membership, she worked for the Highlander Folk School encouraging voter registration and education. The SCLC hired her to form education programs, but her plans for increasing community involvement, protecting the labor rights of black teachers, and educating black voters were often ignored because she was female. The interview ends with her thoughts on why she started receiving more recognition for her work in the mid-1970s."
North Carolina,Margaret Hart,,THE INVISIBLE COMMUNITY: AFRICAN AMERICANS IN BERKSHIRE COUNTY (1830-2012),,https://berkshirehistory.org/invisiblecommunity/,1940s,2000,"She also remembers being at Hart Camp in Williamstown, which was founded in 1947 by her brother, Thomas, as a camp for minority youth to experience the outdoors. She then came back to teach special education in Pittsfield."
North Carolina,Kathleen Crosby,The History Makers,Education Matters,Kathleen Crosby,https://www.thehistorymakers.org/biography/kathleen-crosby-39,1940s-1970s,2002,"From 1967 to 1970, she worked as an in-service specialist for early childhood education. She served as principal of Billingsville Elementary School from 1970-1976. A 1976 CBS NEWS documentary highlighted her outstanding leadership in dealing with school desegregation and busing issues."
North Carolina,Ann Harris Toler,East Carolina University,East Carolina Manuscript Collection,Ann Harris Toler Oral History Interview,https://digital.lib.ecu.edu/special/ead/findingaids/oh0230?q=Oral%20history%20teacher%20#overview,1960s-1980s,11/15/1998,"Interview with retired science teacher, from Washington County, NC, whose father was director of prisons for State of North Carolina, who attended East Carolina Teachers College, worked in the Federal Bureau of Investigations crime lab, Washington, DC, taught science at Pantego High School, Pantego, NC, and Pungo Christian Academy, Beaufort County, NC, 1968-1989. "
North Carolina,Mavis M. Alder ,East Carolina University,ECU Manuscript Collection,Mavis M. Alder Oral History Interview,https://digital.lib.ecu.edu/special/ead/findingaids/oh0217?q=Oral%20history%20teacher%20,1920-1999,11/29/1999,"Interview (ca. 1920-1999) with ECTC graduate and Harnett County, NC grade school teacher, raised on Pitt County tobacco farm, whose two brothers were killed in World War II. "
North Carolina,Charles L. Thompson,University of North Carolina,Southern Oral History Program,"Southern Communities: Listening for a
Change: Desegregation and the Inner Life of Chapel
Hill Schools",https://dc.lib.unc.edu/cdm/compoundobject/collection/sohp/id/27068/rec/1,1940s-1990s,2001,Thompson Role in Education Cabinet and sit-ins.
North Carolina,Jeanne Brayboy,The History Makers,Education Matters,"The HistoryMakers® Video Oral History Interview with Jeanne Brayboy,",https://www.thehistorymakers.org/sites/default/files/A2007_179_EAD.pdf,1950s-1990,2007,"Civil rights activist and school teacher Jeanne Martin Brayboy was born on February 23, 1930, in Camden, South Carolina. Her father, John Wendell Martin, was a high school teacher and football coach; and he started the first African American athletic conference in South Carolina. Her mother, June Singleton Martin, was a librarian. Brayboy and her younger sister, Thomasina, grew up under strict segregation, and they recognized the disparities between whites and blacks in Camden’s educational system. She attended Mather Academy, an African American boarding school founded in 1867 by the Women’s Division of the Northern Methodist Church in Camden, where the teachers stressed academic excellence and community responsibility. Brayboy graduated from Mather Academy in 1947.
Brayboy went on to attend Bennett College in Greensboro, North Carolina, as a music major, where she became active in the Bennett Choir among other campus activities. In 1951, Brayboy graduated from Bennett College with honors and received her B.A. degree in music. She entered Boston University to pursue her M.A. degree in music education. During her tenure at Boston University, Brayboy met Martin Luther King, Jr. Brayboy and King were a part of a small group of friends that attended black social gatherings on campus. She graduated from Boston University in 1953, and started her teaching career in Charlotte, North Carolina. In 1954, she married the late Dr. Jack Brayboy, who was an administrator at Johnson C. Smith University in Charlotte, North Carolina.
Brayboy spent forty years as a teacher in the Charlotte-Mecklenburg School System, from 1953 to 1993. While she worked in the segregated Charlotte schools, she witnessed bus boycotts and sit-ins during the Civil Rights Movement. In 1969, Brayboy became one of the first African American teachers to integrate the Charlotte- Mecklenburg Public Schools. Brayboy retired in 1993.
The mother of two adult children, Jack and Joyce, Brayboy devotes her time to many civic organizations including the Charlotte Symphony Orchestra, Levine Museum of the New South and the Foundation for the Carolinas. In
file:///192.168.19.4/Company/HM%20Interviews/Finding%20Aids/EAD/A2007_179_EAD.html[5/30/2023 9:33:42 PM]
Finding Aid to The HistoryMakers ® Video Oral History with Jeanne Brayboy
2011, Brayboy was awarded the Marie R. Rowe Award by the Symphony Guild of Charlotte, Inc. Jeanne Martin Brayboy was interviewed by The HistoryMakers on June 20, 2007."
North Carolina ,Shirley Malcom,The History Makers,Education Matters,Shirley Malcom,https://www.thehistorymakers.org/biography/shirley-malcom-42,1960s-1980s,2012,She taught biology before obtaining her Ph. D. degree in ecology from Pennsylvania State University in 1974.
North Carolina ,Pearl Swann Carter ,Marshall University ,Marshall University Oral History Collection ,Oral History Interview: Pearl Swann Carter,https://mds.marshall.edu/cgi/viewcontent.cgi?article=1570&context=oral_history,1920s-1960s,"October 1, 2001","Pearl Swann Carter began teaching at a school in Clintonville, West Virginia. She gives us detailed information about her family throughout the interview, including her husband and children, a relative who was a slave, a story about her sister becoming mayor of White Sulphur Springs, and organizations her husband and her family belonged to. "
North Carolina ,E. V. Dacons,University of North Carolina at Chapel Hill ,Southern Oral History Program Collection,Oral History Interview with E. V. Dacons,https://docsouth.unc.edu/sohp/M-0009/menu.html,1960s,"March 4, 1991","Ebson V. Dacons discusses his career as a black high school principal in segregated and desegregated public schools. He was the principal of Lincoln Heights High in Wilkes County, North Carolina, from 1964 until 1968."
North Carolina ,Henry Ell Frye,University of North Carolina at Chapel Hill ,Southern Oral History Program Collection ,Oral History Interview with Henry Ell Frye,https://docsouth.unc.edu/sohp/C-0091/excerpts/excerpt_4968.html,1940s-1980s,"February 18 and 26, 1992","He recalls that despite segregation, black and white children in the farming community played and worked together outside of school. In the late 1940s, Frye left Ellerbe to attend North Carolina A&T in Greensboro. "
North Carolina ,Inez Cannon Jones,East Carolina University (ECU),East Carolina Manuscript Collection,,https://digital.lib.ecu.edu/51301,-1970s,1997,"Oral history interview with Inez Cannon Jones, an African American teacher from Burke County, N.C. Jones describes her childhood, her education at Allen High School for Girls in Asheville, N.C., Bennett College in Greensboro, N.C., Howard University, and the University of Minnesota, her career as a teacher in the towns of Kinston and Lenoir, N.C., and her students. Interviewer: Martha Vaughn."
Ohio,Sylvester Small,The History Makers,Education Matters,Sylvester Small,https://www.thehistorymakers.org/biography/sylvester-small-39,1970s-2000s,2002,"Educator Sylvester Small was born February 26, 1947, in Akron, Ohio. Small graduated from Hower Vocational High School in 1965. In 1966, he enrolled in the University of Akron and by 1971 was teaching in Akron Public Schools"
Ohio,Margaret Peters,The History Makers,Education Matters,Margaret Peters,https://www.thehistorymakers.org/biography/margaret-peters-41,1969–2000s,2006,"Educator and historian Margaret Peters was born on March 12, 1936 in Dayton, Ohio.n 1968, Peters was appointed Black History Resource Teacher for Dayton Public Schools."
Ohio,June Sallee Antoine,The History Makers,Education Matters,June Sallee Antoine,https://sultan.tnstate.edu/search~S3?/X%22teacher%22+and+%22oral+history%22&searchscope=3&SORT=D/X%22teacher%22+and+%22oral+history%22&searchscope=3&SORT=D&SUBKEY=%22teacher%22+and+%22oral+history%22/1%2C165%2C165%2CB/frameset&FF=X%22teacher%22+and+%22oral+history%22&searchscope=3&SORT=D&6%2C6%2C,1950s-1990s,2004,"High school principal and nonprofit executive June Sallee Antoine was born on March 3, 1929 in Sandusky, Ohio. She earned her B.A. degree from Ohio State University in 1951 and her master's degree from Case Western Reserve University in 1956. She worked as a classroom teacher, guidance counselor, and assistant principal in public schools in Northeast Ohio."
Ohio,Ida May Rhodes,University of Cincinnati,"Afro-American Studies Department, Oral History Project, Black Cincinnatians in the 20th Century",Ida May Rhodes:,https://findingaids.libraries.uc.edu/repositories/5/resources/491,N/A,1975,Educator who taught in the Cincinnati Public School system for 42 years. Rhodes taught at Douglas Elementary School for 32 years before moving to South Avondale to integrate the faculty.
Ohio,Dorothy Layne McIntyre ,Cleveland State University ,Oral History Collection,"Dorothy Layne McIntyre Interview, 31 May 2013",https://engagedscholarship.csuohio.edu/crohc000/481/,N/A,2003,"Dorothy Layne McIntyre was born and raised in LeRoy, New York. She is the mother of interviewees Donna McIntyre Whyte and Dianne McIntyre. She was one of the first black women to receive a pilot's license in the United States and possibly the first woman in Ohio to receive such a license. She went to West Virginia State College for her training. She was an accountant, a social worker, and finished her career as a teacher, mainly at the Paul Revere School. She first lived in the Glenville area and then in the Mt. Pleasant area, where she currently resides with her daughter Dianne."
Ohio,Grace Lee Mims, HistoryMakers,HistoryMakers,The HistoryMakers ® Vi,https://www.thehistorymakers.org/sites/default/files/A2014_071_EAD.pdf,,2014,"Radio host and vocalist A. Grace Lee Mims (1930 – 2019) hosted “The Black Arts” and “Artslog” on Cleveland’s WCLV-FM radio for over thirty years. She was an accomplished vocalist and a voice teacher at the Cleveland Music School since 1980. Mims was interviewed by The HistoryMakers® on February 14, 2014, East Cleveland, Ohio. This collection is comprised of the original video footage of the interview"
Oklahoma,Charlamae Rollins,Fisk University,Fisk University Oral History Collection,,https://www.fisk.edu/wp-content/uploads/2020/06/Fisk_Oral_History_Collection1.pdf,N/A,1972,Talks about her early life in Oklahoma and her career as a children's librarian
Oklahoma,Chloe Brown,Oklahoma State University,The Inductees of the Oklahoma Women's Hall of Fame Oral History Project,Oral history interview with Chloe Brown,https://dc.library.okstate.edu/digital/collection/halloffame/id/95/,N/A,2012,"Chloe Brown, a 2011 Oklahoma Women's Hall of Fame inductee and co-founder of Chloe House in Tulsa, Oklahoma, recalls her childhood in the Greenwood community and in a ministering family. She talks about early influences that guided her toward a career in elementary education and her time at Langston University. Brown discusses establishing Chloe House and her interest in helping formerly incarcerated women reintegrate into society. She also shares some of her volunteer efforts within the Tulsa community such as tutoring children."
Oregon,Joy Pruitt,Oregon State University,Oregon Black Pioneers Oral History Collection (OH 42),,https://scarc.library.oregonstate.edu/omeka/items/show/35440,1950s,2018,"In this interview, Joy Pruitt begins by recounting her experience growing up as one of the only Black families in her neighborhood in Portland, Oregon. She discusses the racism and prejudice she faced from both students and teachers as the only Black person in her elementary school class. She goes on to talk about her experience as an undergraduate student at Linfield College, where she was the only Black person in her small town. There, she faced significant racism but credits the support of her parents and the Urban League of Portland for helping her cope. She also discusses her positive experiences of easily making friends with white students and how that affected both her and her friends. Pruitt also spends time recounting her parent’s backgrounds and upbringing in Mississippi, surrounded by substantial, often violent, Klansmen activity.

Pruitt goes on to reflect on her career as a teacher, and the racism she faced being a Black teacher. She briefly recounts her husband’s career as a dentist, as well as the racism he faced in his career while first getting started. Pruitt remarks that she was too busy working and parenting during the Civil Rights Movement to be heavily involved, but that she was a member of many organizations and was heavily involved with the Urban League of Portland throughout her life. She also discusses her experiences buying homes in Portland, and both the racism she faced from her neighbors, and the friends she made in her neighborhoods. Pruitt goes on to share her hobbies and details of her social life, including how much she loves to host and entertain, her active life playing tennis at age 89, and her love of music. Pruitt ends the interview by recounting how lucky she felt to have great parents, supportive friends, a happy childhood, and an active life. Her last message to viewers is to remember the importance of education and supporting children.

Joy Pruitt was born in 1938. Pruitt was born and raised in Portland, Oregon, with her two sisters. After graduating high school, Pruitt attended Linfield College in McMinnville, Oregon, to get her undergraduate degree. With the support of the Urban League of Portland, with whom she was involved as a member, she went on to have a career as a teacher. A year after securing her first teaching job, Pruitt married and moved to Las Vegas, Nevada, where her husband was stationed as a serviceman in the military. After a few years in Las Vegas, where her first son was born, she and her husband moved back to Portland, where they had two more children and bought a home in 1958. Pruitt also considers two other young women who she took into her home and raised to be her children. Pruitt led an active social life of gardening, entertaining, playing tennis, and playing music. At the time of the interview, she was 89, and still led an active social life."
Oregon ,Joyce Braden Harris,Archives West Orbis Cascade,,Oral history interview with Joyce Braden Harris,http://pdxscholar.library.pdx.edu/blackunited_oralhist/3/,1980s-1990,2010,"Oral history interview with Joyce Braden Harris conducted by Jan Dilg from November 18 to December 12, 2018."
Oregon ,Aletha Chavis,Oregon State University,Oregon Black Pioneers Oral History Collection,Aletha Chavis ,http://scarc.library.oregonstate.edu/omeka/exhibits/show/multiculturalvoices/item/35442,1930-1980s,2019,"Aletha Chavis opens this interview by reflecting on her early childhood and the houses she grew up in. She places particular emphasis on the importance of her neighborhood and her community in how she grew up. She then recalls how her parents came to Oregon from Barbados, and how her parents met. She then goes on to reflect on her experiences in school, and the racism she often faced as the only Black student in her class. Chavis remarks how she was usually untroubled or unaware of other people’s racism, and rarely let it affect her. She then discusses her time at Vanport Junior College and the race relations on campus. She then talks about her time working as a nursing aide for disabled children, and her frustration that no one wanted to help the children become more self-sufficient. Chavis then reflects on her time at the Oregon College of Education, where she was forced to live off-campus because there were no other people of color on campus to live with her. She then goes on to talk about her experiences student teaching, and early experiences working as a teacher in Portland, particularly the racism she faced as the only Black teacher at her school. She then goes into detail about the social dancing scene in Portland at the time, and how important dances were, as many other forms of entertainment were not open to Black people. She then goes on to talk about her experience moving to and living in Oakland, California. Chavis takes a brief detour to discuss how her family was the only Black family in her church growing up, and how that affected her relationship with the church. She then recalls in detail her time after she married her husband, and how she spent years moving around constantly due to her husband’s Navy deployments. She particularly focuses on how she experienced race and racism differently in different parts of the county, especially the racism she faced in Beeville, Texas, and Philadelphia, Pennsylvania. She finishes her first interview by discussing how she moved back to Portland with her three daughters after divorcing her husband, and how teaching in Portland differed from teaching in other parts of the United States."
Pennsylvania,James Oscar Lee,The History Makers,Education Matters,James Oscar Lee,https://sultan.tnstate.edu/search~S3?/X%22teacher%22+and+%22oral+history%22&searchscope=3&SORT=D/X%22teacher%22+and+%22oral+history%22&searchscope=3&SORT=D&SUBKEY=%22teacher%22+and+%22oral+history%22/49%2C165%2C165%2CB/frameset&FF=X%22teacher%22+and+%22oral+history%22&searchscope=3&SORT=D&50%2C50%2C,1939-1990s,2003,"Lee earned his B.A. from Central High School, the second oldest high school in the country and formerly accredited to grant degrees. Lee began teaching in 1939. With the onset of World War II, he began teaching aviation engine mechanics to white soldiers in Chicago. After being transferred to the South, Lee was no longer able to teach white soldiers. Following the War, in 1948 Lee worked for Chicago Public Schools as an instructor at the new Dunbar Trade School which changed to a ""vocational"" school."
Pennsylvania,Selma Burke ,Amistad Research Center ,Selma H. Burke interviews,Selma H. Burke interviews,https://amistad-finding-aids.tulane.edu/repositories/2/resources/588,N/A,1991,"Selma H. Burke was an African American teacher and sculptress who designed the portrait for the Roosevelt dime and who founded the Selma Burke Art Center in Pittsburgh, Pennsylvania. The collection consists of 5 audiocassette tapes of interviews conducted by Clifton H. Johnson with Burke in her home in Pennsylvania from May 7-9, 1991. A separate interview conducted on February 20, 1991 is present on a VHS videotape"
Pennsylvania ,Rodney Reed,The History Makers,Education Matters,Rodney Reed,https://www.thehistorymakers.org/biography/rodney-reed-41,1950s-1900s,2011,"Educator Rodney Reed was born in New Orleans, Louisiana on May 16, 1932. He earned his B.A. degree at Clark College in 1951, and his M.A. degree at the University of Michigan in 1956."
Rhode Island,Kenneth Walker,The History Makers,Education Matters,Kenneth Walker,https://www.thehistorymakers.org/biography/kenneth-walker-39,1960s-1990s,2003,"In addition to teaching, Walker directed several programs geared toward improving educational opportunities for low-income students and bettering the quality of urban education in Rhode Island, including Project Upward Bound and the Teacher Corps."
South Carolina,Carlos Gibbons,University of South Carolina,,Carlos Gibbons oral history interview (2),https://search.worldcat.org/title/1158017336,N/A ,2015,"This oral history interview with Carlos Gibbons on May 18, 2015 includes discussions of his time as a student at the University of South Carolina, teaching, working as the superintendent of schools in South Carolina, the merging of the South Carolina Education Association with the Palmetto Education Association"
South Carolina,UF Samuel Proctor Oral History Program,University of South Carolina,"Tom Crosby oral history collection, 2006-2011",,https://digital.tcl.sc.edu/digital/collection/tomcrosbystr/id/89/rec/1,1920s-1940s,2007,"In this oral history interview, Agnes Hildebrand Wilson Burgess discusses her educational experiences at Claflin and Elloree Elementary schools through her graduate work at Temple University and The Sorbonne, her outstanding achievements as an educator, and her travels to France and Kenya."
South Carolina,Dr. Walker Solomon,University of South Carolina,,Dr. Walker Solomon,https://i-share-uiu.primo.exlibrisgroup.com/permalink/01CARLI_UIU/gpjosq/alma99533917212205899 https://www.youtube.com/watch?v=cH6oxHH6eHk,1940-1970,1980,"Solomon, executive secretary of the Palmetto Education Association, 1950-1967, reveals the historical significance of the association as a formidable educational entity for Black educators."
South Carolina,Eugene C. Hunt,"College of Charleston, Avery Research Center for African American History and Culture",,,https://lcdl.library.cofc.edu/lcdl/catalog/lcdl:23400,1990s,1985,"In this third interview conducted in 1985, Eugene C. Hunt (1890 – 1995) talks at first about taking music lessons with Charleston’s most renown music teacher at the time, J. Donovan Moore. He refers in detail to his upbringing in Charleston’s Radcliffeborough neighborhood by mentioning several local families and Avery teachers that lived there, such as the Dashes and the Andersons, Ms. Simms and Ms. Clyde. Regarding religious affiliations, Hunt emphasizes his break with Central Baptist Church and joining of St. Mark’s Episcopal Church. Talking about long musical traditions in his family, Hunt recalls singing in several church choirs throughout high school. Inquiring about Charleston’s East Side and its bad reputation, Hunt elaborates on the varying ethnicities comprising the mixed neighborhood. Hunt mainly attributes the acquirement of his vast knowledge in African American and Charleston history to the schools he attended, his family, and people he frequently interacted with, such as Dr. John McFall. Referring to his parents’ professions, Hunt describes his family’s economic situation as poor. However, he emphasizes his parents’ desire to provide a good education for their children. Hunt mentions Ms. Jeannette Cox’s influence and guidance on his academic interests in Communication, English and Speech during his years in college. The interview then talks about the importance of storytelling and narratives in the African American community before"
